prov_ref,prov_descr
P139725,kit transapical xt ascendra ii 23 mm
P139726,kit transapicalxt ascendra ii 26 mm
P139727,kit transap.transf.ascendra 29mm
P139732,rodilla componete femoral cemen. rt plus
P139733,rodilla base tibial cementada rt plus
P139777,cadera implante compt. proximal a medida
P139816,anillo abierto rigido tridimensional
P139820,rodilla base tibial all poly onlay genes
P139831,rodilla compt. femoral genesis ocurris
P139842,malla luxacion acromio clavicular lac
P139844,rodilla tibial metalico nexgen preocat
P139952,cadera tornillo encerrojado evl
P139976,rodilla inserto tibial advance m/p
P139979,rodilla rotula advance enclastrada
P139980,coils  fibrados de liberacion mecanica
P139991,implante escleral esnoper
P139992,cadera cabeza metasul 12/14
P139993,rodilla inserto polietileno c/tornillo
P140051,espiral p/embolizacion recubierto azur
P140052,sistema de liberacion de coil
P140086,rodilla componente tibial profix
P140096,cadera vastago largo exceter v40
P140100,espiral p/embolizacion recubierto azur3d
P140118,cadera tornillo para cotilo
P140132,conduit tcp granulados 15 cc
P140155,protesis endovascular aaa
P140200,protesis de iris ips doble
P140201,dbm putty desmineralizado bone matrix 1c
P140218,cadera vastago sl twin/plus
P140237,columna malla synmesh titanio
P140238,columna anillo terminal titanio
P140239,columna tornillo cierre m2/m3
P140240,stent multicapa autoexp. cardiatis
P140249,columna conector ti ajust
P140250,columna conector ti fijo
P140306,stent coronario premontado magic
P140365,cemento confidence kit s/aguja 283913000
P140366,columna tornillo exp poli osteopor
P140444,stent cornario con farmaco evolution
P140446,osteo tornillo recon t2 cefalico
P140574,columna(n )barra curva p.placa  s4c
P140575,columna(n )placa occipital med 4 ag s4c
P140576,"columna(n )tornillo poliaxial 3,5x20mm"
P140577,"columna(n )tornillo poliaxial 3,5x26mm"
P140579,"columna(n )tornillo poliaxial 4,5x8mm"
P140581,columna(n )tornillo conexion apretar
P140611,osteo placa diphos
P140612,osteo tornillo cortical fijacion distal
P140613,osteo tornillo cortical con angulacion
P140615,osteo tornillo esponjosa con angulacion
P140652,stent traqueobronquial endoxane tf20l80
P140946,anillo tension capsular 10 mm
P140947,anillo tension capsular 11 mm
P140948,anillo tension capsular 12 mm
P141026,anclaje para electrodos
P141040,stent coronario liberador sirolimus
P141085,generador impulsos recargable corrt. con
P141114,columna tornillo poliaxial expedium
P141115,columna cierre si expedium
P141147,anillo  mitral  sovering
P141263,cadera inserto cotilo shy
P141297,pericardio grande 6 x 6 cm 600023 peri l
P141298,pericardio mediano 3 x 5 cm 600024peri m
P141506,osteo maxilo placa orbital izq. derecha
P141507,"osteo maxilo tornillo lactosorb 1,5x7mm"
P141510,"desmineralizado dbm putty bone matrix 2,"
P141527,barra costal 190 mm complet denta titani
P141529,"clip costal titanio 45o22,5o22o std. xl"
P141530,barra pectus 150mm parc. dentada titanio
P141680,placa craneotomia recta 2 aguj 11mm biop
P141712,placa craneotomia 4 aguj 17 mm bioplate
P141713,placa craneotomia . 4 aguj 10mm bioplate
P141714,tornillo craneotomia 3mm 4 mm 5 mm
P141716,columna barra  300 mm titanio expedium
P141717,desfibrilador protecta vr d364vrg recamb
P141741,pie  placa advansys ttcp
P141742,"pie  tornillo titanio 4,5-6,5 contratorn"
P141920,valvula biologica  mitroflow peri dl
P141936,columna placa cervi venture 19 a 50 mm
P141937,columna tornillo autoterrajante angulo v
P141938,columna malla tit pyramesh 13mmx30 70 mm
P142008,"osteo tornillo multiloc 4,5 mm"
P142009,osteo tornillo cierre  multoloc
P142024,osteo clavo humero proximal multiloc
P142032,desfibrilador protecta vr  d364vrg compl
P142033,desfibrilador protecta crt d364trg recam
P142034,desfibrilador protecta crt d364trg compl
P142180,cadera cabeza delta articuleze
P142187,columna rotula fijacion barra p. bajo
P142188,columna rotula conexion transv p/barra p
P142190,columna barra percutanea
P142194,cadera vastago s- rom
P142198,cadera vaina s-rom
P142199,cadera cabeza s-rom
P142202,protesis vascular con plata intergard
P142231,columna sustituto cuerpo vertebral exten
P142238,columna tornillo ensambld. cabeza poli
P142239,columna espaciador interespinoso dinamic
P142240,columna espaciador intersomatico curvo
P142246,columna gel barrera antifibrosis
P142247,columna tornillo poliaxial
P142248,columna tornillo de cierre
P142249,columna protesis de disco cervical
P142356,stent coronario resolute integrity
P142555,marcapaso dr vitalio
P142556,marcapaso tricameral intua
P142577,extension iliaca
P142804,"columna(n) tornillo poliaxial 6,5x50mm c"
P142805,"columna(n) tornillo poliaxial 6,5x45mm c"
P142806,"columna(n) tornillo poliaxial 6,5x40mm c"
P142807,columna(n) tuerca cierre
P142808,"columna(n) barra conexion 5,5x40mm rec/h"
P142809,cadera cabeza metalica bioball
P142810,cadera adaptador bioball mszi cuello lar
P142895,rodilla inserto triccc
P142896,rodilla componente femoral triccc
P142897,rodilla componente tibial triccc
P143035, vascu tubular bifurc poli c/gelat
P143036,vascu tubular recta ptfe s/refu hepa st
P143038,vascu tubul rect poli s/ref c/gelat 60m
P143039,vascu tubul recta poli s/refc/gel 80 cm
P143040,stent aututoexp. no recub. + de 150 mm
P143054,stent coro exp. no recub. s/carbon pirol
P143055,endoprotesis aortouniliaca a medida
P143056,endoprotesis toracica recta y conica st
P143057,vascular hemodi ptfe recta c/refuerzo
P143058,stent vascular viabahn propaten 10 cm
P143059,stent vascular viabahn propaten 5 cm
P143060,stent vascular viabahn propaten 15 cm
P143067,vascular t. rect ptfe c/refuerzo heparin
P143072,vascular t. rect ptfe c/refuerzo s/ hepa
P143090,fijador ext apex 6 mm y transfixiantes
P143092,stent autox recub. ptfe s/drog 10 cm
P143094,stent autx. no recub s/drog de nitin.5fr
P143111,"fijador ext  peq diametro de 1,6 a 5 mm"
P143112,fijador ext apex p. recubiet hidroxiapat
P143114,fijador ext hoffman ii articul y garras
P143115,"fijador ext hoffman ii barra uni 3,5 8mm"
P143116,fijador ext hoffman ii barra uni semicir
P143117,fijador ext hoffman ii barra de conexion
P143118,fijador ext hoffman ii com garra per art
P143119,fijador ext hoffman ii comp tub com/dist
P143120,fijador ext hoffman ii garra pelvis
P143124,fijador ext hoffman ii t.azul dinam/dist
P143148,protesis vascular de dacron
P143159,toracica recta  conica std 1 seg c/stent
P143163,toracica recta  conica stand 3 seg 1
P143165,toracica recta  conica stand 3 seg 2
P143166,toracica recta  conica stand 3 seg 3
P143169,stent autx no recubt. s/droga hasta 150m
P143172,stent autx  troncos distales hasta 100mm
P143222,bifurcada .fijacion suprarenal bimodular
P143223,endoprotesis aortouniliaca standard
P143224,tor recta y conica standard 2 seg 1
P143225,tor recta y conica standard 2 seg 2
P143228,endoprotesis branques viscerales
P143230,parche vascular poliest p/ carotida
P143261,parche vascular poliest p/ cart c/hepari
P143263,p. vascular tubular bifur poli c/colagen
P143264,p. vascular tubular rect poli c/colageno
P143265,p. vascular tubular rect poli c/refuerzo
P143266,p. vascular tubular axilobifur p. c/plat
P143267,p. vascular tubular bifurc pol c/plata
P143268,p. vascular tubular rect poli c/plata
P143284,toracica anterograda  poliester libre
P143309,stent autx no recubt hasta 36 mm 14f
P143310,stent autx no recubt hasta 36 mm 16f
P143315,osteo tornillo-emerg plusdrive autorrosc
P143316,osteo pl-lock 2 peq c/espacio
P143317,osteo pl-lock 2 p/mandibula
P143318,osteo pl-lock 2 p/mandibula ti
P143319,osteo pl-lock 2 p/mandibula gr
P143320,osteo pl-lock 2 p/mandib gr 20 aguj l159
P143326,"osteo maxilo miniplaca 2,0"
P143327,"osteo maxilo microplaca 1,5"
P143328,"osteo maxilo microplaca 1,0 recta"
P143329,"osteo maxilo malla suelo de orbita 1,5 m"
P143330,osteo maxilo placa recon ts recta
P143334,electrodo hemod. estm. endocardica
P143335,rodilla componete femoral
P143336,rodilla componete patelar
P143337,osteo pl-lock 2 p/mandib ang
P143339,osteo tornillo imf acero
P143376,testicular gel
P143381,cadera  cabeza ceramica delta
P143389,"osteo maxilo cross drive tornillo 2,7"
P143390,osteo maxilo bateria esteril para bos
P143401,osteo maxilo miniplaca 2.0-l
P143402,osteo maxilo miniplaca 2.0 otras formas
P143403,"osteo maxilo miniplaca 1,5 otras formas"
P143405,"osteo maxilo microplaca 1,0-l"
P143406,"osteo maxilo microplaca 1,0 / 2 otras fo"
P143411,osteo maxilo placa recon ts 6
P143658,rodilla tendon rotuliano + cuadricipital
P143659,rodilla uni componente tibial  allpoly
P143868,desfibrilador contak cd 1823 h135
P143869,electrodo auric f.activa  45 cm marcapas
P143928,sistema de fuson interespinoso temporal
P143935,hombro nucleo simpliciti
P143936,hombro cabeza humeral simpliciti
P144025,cadera vastago recto/curvo  revitan
P144026,cadera cuerpo proximal revitan
P144043,stents balon exp. premot ampliable 20mm
P144254,rodilla inserto tibial revision
P144271,protesis total de disco cervical
P144345,osteo maxilo placa recon ts 6+ 20 aguj
P144346,stent expandible por balon
P144362,cadera component femoral proximal standa
P144363,cadera vastago no cementado recto
P144364,osteo guia  sin oliva str
P144365,cadera insero antilux para cotilo
P144497,rodilla  vastago de extension
P144498,rodilla  conector offset
P144499,rodilla inserto tibial fijo
P144500,rodilla base tibial
P144531,rodilla  aumentador distal
P144532,rodilla  componente femoral
P144629,acceso venoso plastico alta presion
P144732,rodilla charnela modular escudo patelar
P144733,rodilla segmento titanio femoral
P144734,rodilla segmento distal femur
P144735,rodilla set  recambio articul a charnela
P144800,osteo maxilo placa fractura s. 6 agu cur
P144863,osteo tornillo cortical
P144865,osteo placa bloqueop/radio distal
P144866,"osteo tornillo bloqueo 2,5x8mm"
P144885,artro tornillo 36mm top hat
P144974,artro kit laserjet
P145058,"coil embolizacion arterial  0,20"
P145060,fijador ext. barra articulada rapida
P145111,fijador ext. pin ha 6mm
P145112,fijador ext. aguja punta bayoneta
P145113,fijador ext.  aguja con oliva
P145114,fijador ext.  aro completo
P145115,fijador ext.  aro 2 / 3  de 155 mm
P145116,fijador ext. identificador barra rapida
P145117,fijador ext.  vaina de centrado
P145118,fijador ext. tornillo hexagonal fijacion
P145119,fijador ext.barra articulada extra x-peq
P145120,fijador ext.  rancho cubo 1 agujero
P145121,fijador ext. rancho cubo 2 agujeros
P145122,fijador ext. rancho cubo 4 agujeros
P145123,fijador ext. bisagra macho
P145124,fijador ext. soporte 3 ag mach
P145125,fijador ext. tornillo 12 mm
P145126,fijador ext. arandela ranurada 3mmx14mm
P145127,fijador ext. arandela  2 mm x 14 mm
P145128,fijador ext.  barra roscada 300mm
P145129,fijador ext. barra tornillo 30mm
P145489,osteo maxilo distractor mandibular
P145592,pie tornillo conpresion canulado 3.0
P145593,hemidiafisis de femur
P145594,maxilo piel artificial
P145598,valvula hidrocefalia  a 0 cmh20 p/sedent
P145599,valvula hidrocefalia  a 5 cmh20 p/sedent
P145600,valvula hidrocefalia  a10 cmh20 p/sedent
P145778,columna adaptador simple para tornillos
P145779,columna sistema de jeringas vertecem
P145780,columna sistema  cemento vertecem v+este
P145799,stent coronario r/ serolimus s/polimer
P145812,parche pericardio  bovino 6 x8 cm
P145861,columna conector paralel p/barra titaneo
P145863,electrodo estim f.activa  53 cm marcapas
P145864,electrodo estim f.activa  60cm marcapas
P145865,electrodo estim f.pasiva   60cm marcapas
P146052,generador  impulsos recargable 16 polos
P146054,cargador p/ generador 16 polos
P146055,programador paciente p/genrador imp
P146056,electrodo percutaneo plano octopolar
P146057,electrodo percutaneo tetrapolar
P146058,extension doble
P146068,lamela endotelial
P146082,desfibrilador dai monocameral
P146083,desfibrilador dai bicameral
P146084,desfibrilador dai tricameral
P146106,cadera inserto ceramica biolox delta
P146198,mano componente radial
P146199,mano componente carpiano
P146200,mano polietileno carpiano
P146218,codo espaciador a medida c/ceftriaxona
P146219,"osteo placa lcp 2,4 en  l p/radio discal"
P146220,rodilla seg titanio femoral bicondilar
P146246,traqueal y bronquial16-13-13 brazos cort
P146260,anillo para anuloplastia dinamica
P146281,"mano tornillo 4,5 mm"
P146282,columna (n) placa nivel c2-t1 de 36mm
P146283,columna (n) placa nivel c2-t1 de 44 mm
P146284,columna (n) placa nivel c2-t1 de 57mm
P146288,"columna (n) tornillo 4,2x12mmp/pl.cerv"
P146567,rodilla  vastago modular cement/no cemen
P146568,rodilla segmento tibial
P146581,rodilla comp. femoral cementado
P146582,rodilla base tibial cementada simetrica
P146583,rodilla inserto tibial cr/dd
P146584,rodilla rotula  tres pernos
P146594,rodilla componente femoral revision
P146596,rodilla base tibial revision
P146598,rodilla inserto fijo
P146599,rodilla vastago
P146601,rodilla aumento femoral distal/posterior
P146602,rodilla conector offset
P146606,rodilla componente femoral ps/cr
P146607,rodilla bandeja tibial c/vastago quilla
P146608,rodilla inserto tibial cr/ps
P146609,rodilla rotula tres pivotes
P146627,columna (n) sist.corp.cervic tantalio 20
P146648,rodilla componente femoral distal
P146649,rodilla superficie articular
P146651,rodilla cajon de polietileno
P146652,rodilla segmento femur/tibia macho hembr
P146654,rodilla collar para vastago
P146656,rodilla vastago cementado
P146658,rodilla kit de servicio cementado
P146818,pie tornillo tenodesis-bio
P146819,pie sutura fiberlop2 c/aguja recta
P146821,osteo placa escapula/glenoide
P146825,sistema armazon biorreabsorvible
P146932,"stent renal 4,5 mm x 12mm crco"
P146933,stent renal 5mmx19mm crco
P146947,cadera inserto ceramico
P147300,hombro hmrs humero
P147331,hombro hmrs humero pieza extens
P147332,hombro hmrs pieza anclaje
P147333,"hombro hmrs tornil cortical 3,6 mm"
P147334,hombro hmrs humero tornillo conex/bloq
P147391,stent coronario cromo cobalto
P147392,hemiarteria pulmonar
P147393,arteria iliaca >40 cm
P147394,dos arterias iliacas
P147395,arteria femoral >40 cm
P147396,dos arterias femorales long conj >40cm
P147442,stent autoex recubt c/ herparina
P147486,barra estabilizadora para pectus
P147487,estabilizador de placas estandar pectus
P147522,valvula biolog peric bovino c/anillo sut
P147607,dispositivo reconstruc vascular nitinol
P147631,osteo maxilo placa recon ts 20aguj recta
P147632,cadera vastago element s/collaroffset st
P147633,cadera cabeza femoral cocr
P147634,cadera copa orificios agrupados
P147635,cadera inserto reborde
P147636,cadera tornillo oseo
P147646,sistema para implantacion de clip mitral
P147714,rodilla aumento femoral distal/posterior
P147734,rodilla componente femoral
P147735,rodilla tornillo neutral adapt offset
P147736,rodilla adaptador femoral de 5 y 7 grad.
P147737,rodilla inserto tibial
P147757,desfibrilador monocameral  conexion df-1
P147758,desfibrilador bicameral  conexion df-1
P147759,desfibrilador tricameral conexion df-1/i
P147760,desfibrilador tricameral conexion df-1/
P147762,parche  tejido  blando de ptfe 18x24 2mm
P147907,osteo maxilo malla fract 2x6ags rec/curv
P147908,osteo maxilo miniplaca 14 agj recta t=1m
P147909,osteo maxilo placa fra. 4/6 agj rect/cur
P147910,osteo maxilo placa fra. 6/8 agj ang larg
P147941,"osteo maxilo tornillo tipo locking 2,0"
P147967,rodilla tapon femoral p/pasador standard
P147977,rodilla tornillo de cierre vastago tibia
P148003,rodilla camisa tibial de polietileno
P148004,rodilla inserto tibial proximal
P148007,rodilla protector tibial polietileno
P148009,rodilla tapon bloque sistema ensamblaje
P148010,rodilla componente femoral grande dcha
P148011,rodilla pieza de extension
P148012,rodilla componente femoral distal 65 mm
P148013,rodilla eje femur distal pequeno
P148014,rodilla tapon femoral p/pasador femora p
P148015,rodilla inserto 16mm s1/s2
P148099,set de puncion protesis de voz
P148111,endovascular bifurc c/polimer +autoinyet
P148147,anillo abierto semirrigid tridimensional
P148248,hombro componente glenoideo metal
P148249,hombro conector y tornillo p/glenosfera
P148292,hombro  recubrimt cefal global conserv
P148329,cadera cabeza ceramica
P148330,cadera inserto ceramico
P148535,columna aguja guia sist. serengueti 11g
P148537,"columna barra fijacion 5,5 y 100mm"
P148541,columna rectractor s. serengueti
P148542,columna bloqueador de tornillo
P148543,"columna tornillo bloqueo 5,5x40polyaxial"
P148549,"columna tornillo 7,5x35 mm polyaxial"
P148571,"columna tornillo 6,5x40 mm polyaxial"
P148572,"columna tornillo canulado6,5x40 mm polya"
P148573,"columna tornillo canulado6,5x45 mm polya"
P148730,"pie tornillo compresion canul 6,5a 7,5mm"
P148791,"pie placa reconst.tibia/perone 3,5mm"
P148792,pie placa reconst astragalo
P148793,"pie tornillo cortical bloq. 2,5 mm"
P148794,"pie tornillo cortical no bloq. 2,5 mm"
P148795,"pie tornillo cortical no bloq. 2,7 mm"
P148796,"pie tornillo cortical no bloq. 3,5 mm"
P148798,"tobillo placa fusion 3,5 y 4,5 mm 3a5 ag"
P148799,"tobillo tornillo cort no bloq 3,5 y 4,5"
P148800,"tobillo tornillo cort bloq 3,5 y 4,5"
P148813,tobillo tornillo espj rosca 4mm
P148814,"tobillo tornillo canulado bloq 5,7 mm"
P148862,"columna tornillo polyaxial perf. baj 5,5"
P148863,columna barra recta /curvada
P148869,stent cornario recubierto c/polimer
P148898,s. implat vavula aortica trascateter29mm
P149009,columna barra 3mmx120
P149067,"columna tornillo poliaxial 3,5x16mm"
P149068,columna tornillo interno s. vertex
P149069,"columna barra cervical 3,2x120mm"
P149087,bifurcada vascular iliaca con segmento
P149104,columna conector transversal ajustable
P149287,columna s. fusion inter 10x27 mm7 mm
P149290,columna s. fusion interespin10x27 mm 9 m
P149302,columna s. fusion interespin11x14 mm6 mm
P149304,drenaje en f. de t con valvula y resevor
P149306,cadera inserto doble mov. metalico largo
P149315,cadera inserto doble movilidad
P149316,osteo tornillo asls
P149317,osteo vaina asls
P149510,osteo tornillo canulado biorreabsorbible
P149671,stent biliar  nitinol marcas radiopacas
P149757,osteo tornillo canulado de  7mm
P149787,columna malla pyramesh circ / oval / red
P149817,osteo maxilo tornillo autoperforante 2
P149818,"osteo maxilo placa titanio 2,0"
P149819,"osteo maxilo imfimplant 2,0"
P149904,lente intraocular soportada iris
P149906,sistema filtracion y drenaje de glaucoma
P149907,lamela anterior
P149908,cadera espaciador metalico talla l
P149970,cemento para cifoplastia  20 g.
P149999,"malla biologica dermis porcino 5x5cm 1,4"
P150,p150
P150042,osteo tornillo canulado mini-compresion
P150043,"osteo aguja kirschner 1,2 x100 mm"
P150377,stent coronario c/serolimus b. perfil
P150378,columna conector abierto 10 mm off-set
P150379,"columna gancho laminar c/off-set 4,4 mm"
P150380,columna barra tit. precurvada occipital
P150398,osteo clavo lns-gt standard
P150399,osteo tornillo cefalico 9mm
P150400,"osteo tornillo distal 3,5-4,5 mm"
P150402,osteo tornillo proximal - antirrotaciona
P150411,"columna tornillo tit. occipital 4,5"
P150412,columna placa occipital selct tit grande
P150570,"artro anclaje de sutura 1,3 mm"
P150573,rodilla inserto tibial
P150728,cemento con gentamicina 40g
P150747,artro regenerador de cartilago
P150782,artro anclaje meniscal 2 puntos
P150783,artro anclaje meniscal 3 puntos
P150784,artro anclaje meniscal 6 puntos
P150821,endosut. mec. endov. abd. 16f gu 22mm(pr
P150823,endosut. mec. endov. tora. 18f g 22mm pr
P150825,endosut. mec. endov. tora. 18f g 42mm pr
P150997,"malla biologica dermis porcino25x18 1,4"
P150999,tira cresta iliaca bicortical 2x6cm
P151140,osteo aguja kirschner c/punta  tr p frag
P151149,osteo aradela p/tornillo canulado
P151150,"osteo tornillo canulado o3,5-4mm."
P151151,osteo placa ant de estb angular tibia di
P151152,osteo tornillo bloq autorroscante
P151153,osteo tornillo cortical autorroscante
P151181,"osteo tornillo canulado o4,5-5,5mm."
P151182,"osteo tornillo canulado 4,5-6,5mm"
P151183,osteo tornillo canulado o7-8mm
P151188,osteo tornillo bloqueo autorroscante
P151189,osteo placa radio distal
P151190,osteo clavija de sosten
P151191,"osteo tornillo de cortical 3,5 mm autorr"
P151196,osteo clavija de sosten
P151199,osteo aguja guia con oliva esteril
P151200,osteo aguja guia sin oliva esteril
P151214,condilo femoral osteoarticular 210200
P151216,osteo  tornillo  fijacion  placa bloqueo
P151228,"osteo placa adaptacion o1,3mm"
P151229,"osteo placa adaptacion o1,5mm"
P151230,osteo placa adaptacion o2mm
P151231,"osteo placa adaptacion o2,4mm"
P151232,"osteo placa condilea o2,4mm"
P151233,"osteo placa rejilla o1,3mm angulo oblicu"
P151234,"osteo placa rejilla o1,5mm angulo oblicu"
P151235,osteo placa lc-dcp o2mm
P151236,"osteo placa lc-dcp o2,4mm"
P151237,osteo tornillo cortical autorroscante
P151239,osteo aguja kirschner p/trocar pequenos
P151240,"osteo tornillo 2,7mm bloque / no bloque"
P151241,osteo aguja kirschner
P151242,osteo cabeza de radio
P151243,osteo vastago para cabeza de radio
P151244,osteo placa estab angul anat cubit proxi
P151245,osteo plac humer dista medial/dorsolater
P151246,"osteo tornillo bloqueo 2,5-3mm autorrosc"
P151247,"osteo tornillo bloqueo 3,1-3,5mm autorro"
P151248,osteo tornillo cortical autorroscante
P151267,osteo clav endom prox cort torni prision
P151268,osteo sistema cierre
P151269,osteo dispositivo cefalico rosacado
P151270,osteo clav endom prox larg torni prision
P151271,osteo aguja kirschner p. trocar g. fragm
P151272,"osteo tornillos de cortical 3,5mm autorr"
P151292,osteo clavo humero proximal largo titani
P151293,osteo clavo humero ant retrog fdiafisari
P151294,osteo placa de clavicula
P151295,osteo placa  sinfisis aguj combin coaxia
P151297,osteo clavo endomedular tibia gentamicin
P151298,osteo tornillo doble rosca sin cabeza
P151303,osteo placa reconstrucc pelvica p. bajo
P151327,estabilizador para  barra pectus
P151370,cadera vastago
P151381,artro s. anclaje femoral ligamt cruzado
P151411,cadera cuello modular
P151412,columna barra predoblada
P151431,columna caja fij.cervica inters. angulad
P151444,esponjosa  triturada 30cc.
P151573,cadera adaptador bioball 12/14
P151574,"cadera adaptador 7,5o offset 12/14"
P151575,"cadera adaptad bioball mszi v40 7,5 offs"
P151576,cadera cabeza ceramica bioball delta
P151577,cemento cemex fast manual 20x20 gr.
P151623,tunelizador para sistemas medtronic dbs
P151624,adaptador 2x4 p/neuroestimulador cerebra
P151625,cubierta orifi trepanaci s /fijac/ elect
P151631,extension para generador
P151632,adhesivo para generador
P151636,esfinter cont.urinaria bomba control
P151638,esfinter cont.urinaria manguito oclusivo
P151639,esfinter cont.urinaria kit accesorios
P151640,fijador externo barra articulada tsf
P151662,protesi de penis maleable
P151663,protesi de penis hidraulica escrotal
P151667,protesi de penis hidraulica reservorio
P151668,protesi de penis hidraulica kit montaje
P151705,artro tornillo interfcanulado hth
P151706,artro tornillo interf canul semitendinos
P151707,"artro implante impacno absorb 4.5-5,5 mm"
P151708,artro implant rosc absorb 4.5-5.5-6.5mm
P151709,artro anclaje impact reab c/sutura prean
P151725,desfibrilador monocameral 8 choques prog
P151726,electrodo p/ desf monocam 8 choques
P151727,desfibrilador tricameral 8 choques progr
P151729,electrodo  de seno p/desfibrilador trica
P151730,electrodo auricular p/ desf tricameral
P151756,desfibrilador unicameral estimul antibra
P151757,electrodo ventricular p/desf. unicameral
P151758,desfibrilador bicameral estimul antibrad
P151760,electrodo ventricular p/desf. bicameral
P151790,endoprotesis toracoabdominal 4 ramas (pr
P151791,electrodo ventriculo izq.p/desf tricamer
P151792,sensor hemod. p/ desfibrilador tricamera
P151846,electrodo endocad. auri/ventri
P151852,cemento manual alta/baja densidad 50 gr.
P151860,electrodo p/desf. monocameral s. acce
P151917,desfibrilador monocameral latido/latido
P151918,desfibrilador bicamerallatido/latido
P151919,desfibrilador tricameral latido/latido
P151932,electrodo auricular p/desf tricameral
P151933,electrodo ventriculo izq p/desf tricamer
P151936,"malla de titaneo plana 1,5mm"
P151939,malla  plana refu  p/ eventrac 150x150x3
P151940,malla  plana refu  p/ eventrac 35x22cm
P151971,malla  plana refuerz  p/ eventrac 8x13cm
P151972,malla tapon p/ hernia umbilical 6cmx3
P151973,malla tapon p/ hernia umbilical 8cmx3
P152020,rodilla componente articular sust condilar
P152027,cadera segmento de vastago 28(30a60mm)
P152028,cadera segmento de vastago 28(100-150)
P152029,cadera segmento cuello masivo 65/35mm
P152030,cadera tornillo expansivo 61/4mm
P152061,rodilla anillo soporte 10mm
P152062,rodilla vastago femoral cementado
P152063,rodilla espaciador diafisiario
P152064,cadera componente conexion p/femur total
P152145,endoprotesis bi-modular cr-co c/ ptfe
P152170,osteo maxilo placa recon 26
P152312,columna n disposi inters tlif bullet
P152329,lente  acrilica hidrofilica
P152333,esponjosa  en chips can15 liofilizado
P152547,cadera cabeza cromo cobalto 36mm
P152603,tendon aquileo sin pastilla osea
P152822,columna sust oseo granu hidro 1-2mm/2cc
P152823,columna sust oseo granu hidro 1-2mm/5cc
P153081,"osteo aguja guia 1,6 mm."
P153082,osteo aguja guia 2.0 mm.
P153083,osteo aguja guia roscada 3.2 mm
P153084,osteo aguja kirschner 3.2 x 250 mm.
P153085,osteo aguja kirschner roscada 3.2x250mm
P153138,s/oclusor septal c/lib niquel/titaneo 20
P153139,s/oclusor septal c/lib niquel/titaneo 25
P153140,s/oclusor septal c/lib niquel/titaneo 30
P153196,s.complet. dispositi oclusor dobl. disco
P153318,stent coronario ali. farmac evorolimus
P153337,cateter intratecal reforzado 114 cm
P153338,"lente hidrofobica l/brill. 0,0 d a 30,0"
P153339,rodilla componente femoral de revision
P153340,rodilla vastago offset / recto revision
P153351,desfibrilador contak cd 1823 h135
P153352,rodilla bandeja tibial de revision
P153353,rodilla inserto tibial de revision
P153480,osteo hombro guia
P153481,osteo cable guia
P153580,pie sutura poliester 2 3/8 26mm 122cm
P153597,clip sugita temporal recto 7x8mm
P153598,clip sugita temporal l/curvo11x9mm
P153599,clip sugita temporal doblado 8x8mm
